{
  "schema_version": "1.0.0",
  "quota_id": "quota-hard-breach",
  "scope_type": "worktree",
  "scope_id": "h06-f00-hadaf",
  "resource_kind": "retries",
  "limit_type": "hard",
  "value": 1,
  "unit": "count",
  "enforcement": "runtime_enforced",
  "current_usage": 2,
  "breach_status": "breached",
  "human_override_required": true,
  "cannot_claim": [
    "production_resource_orchestration",
    "mechanically_independent_agents",
    "stable_agents",
    "self_hosting_ready",
    "release_candidate",
    "production_ready",
    "H07_proof_engine_implemented",
    "H08_git_ci_pr_merge_conductor_implemented"
  ]
}
