{
  "schema_version": "1.0.0",
  "quota_id": "quota-private-path",
  "scope_type": "box",
  "scope_id": "H06",
  "resource_kind": "disk",
  "limit_type": "hard",
  "value": 500,
  "unit": "\u002fUsers\u002fusman\u002fprivate-mb",
  "enforcement": "runtime_enforced",
  "current_usage": 10,
  "breach_status": "within_limit",
  "human_override_required": true,
  "cannot_claim": [
    "production_resource_orchestration",
    "mechanically_independent_agents",
    "stable_agents",
    "self_hosting_ready",
    "release_candidate",
    "production_ready",
    "H07_proof_engine_implemented",
    "H08_git_ci_pr_merge_conductor_implemented"
  ]
}
